paragraph_number,paragraph_text,sentiment_score
1,"Good afternoon, the Vice-President and I welcome you to our press conference....",0.75
2,The Governing Council today decided to keep the three key ECB interest rates unchanged. Our updated ...,0.0
3,"The new Eurosystem staff projections show headline inflation averaging 2.1 per cent in 2025, 1.9 per...",0.08162878787878788
4,We are determined to ensure that inflation stabilises at our two per cent target in the medium term....,0.2388888888888889
5,The decisions taken today are set out in apress releaseavailable on our website....,0.0
6,I will now outline in more detail how we see the economy and inflation developing and will then expl...,0.25
7,"The economy has been resilient. It grew by 0.3 per cent in the third quarter, mainly reflecting stro...",0.08809523809523809
8,"The economy is benefiting from a robust labour market. Unemployment, at 6.4 per cent in October, is ...",0.0
9,The staff projections see domestic demand as the main engine of growth in the years ahead.Real incom...,0.07464646464646464
10,The Governing Council stresses the urgent need to strengthen the euro area and its economy in the pr...,0.11904761904761905
11,Annual inflation has been in a narrow range since the spring and remained at 2.1 per cent in Novembe...,0.11333333333333333
12,Indicators of underlying inflation have changed little over recent months and remain consistent with...,0.09895833333333333
13,"Inflation should decline in the near term, mostly because past energy price rises will drop out of t...",0.07333333333333333
14,"Most measures of longer-term inflation expectations continue to stand at around 2 per cent, supporti...",0.375
15,"While trade tensions have eased, the still volatile international environment could disrupt supply c...",0.12546296296296294
16,The outlook for inflation continues to be more uncertain than usual on account of the still volatile...,0.07948089492207139
17,Market rates have increased since our last meeting. Bank lending rates for firms have been broadly s...,0.008143939393939393
18,"Bank lending to firms grew by 2.9 per cent on a yearly basis in October, unchanged from September. C...",0.22083333333333333
19,"In line with our monetary policy strategy, the Governing Council thoroughly assessed the links betwe...",0.07592592592592592
20,The Governing Council today decided to keep the three key ECB interest rates unchanged. We are deter...,0.21111111111111114
21,"In any case, we stand ready to adjust all of our instruments within our mandate to ensure that infla...",0.30000000000000004
22,"Two questions, President Lagarde. The first one is about interest rates, and the question is: Are we...",0.2157407407407407
23,"The second question is about economic growth, given your second straight, fairly large revision in t...",0.21369539551357733
24,"On interest rate, we reconfirmed that we are in a good place, which does not mean that we are static...",0.4015625
25,"Your second question is, always an interesting question from you, but it's an interesting question b...",0.3333333333333333
26,"We think that there is some change taking place in our economies, and if you look in particular at t...",0.09365079365079365
27,"So that is something that we can already analyse, but I think we will be able to go a bit deeper in ...",0.16742424242424242
28,"The second one, which came as a bit of a surprise to us, is the contribution of exports. We had anti...",0.15238095238095237
29,"So, we don't know whether it's entirely attributable to the weight-losing drugs that are largely exp...",0.12366071428571429
30,"I have a question as well, going back to Isabel Schnabel's comment on the rate hike: Are you as comf...",0.13333333333333333
31,Second question is on the fiscal stimulus in Germany: We were waiting for that for this year; now th...,0.018750000000000003
32,"You know, certain things have changed and others have not changed. So, when we look at activity, we ...",0.21428571428571427
33,"One thing that has not changed much at all and which, if anything, may have actually worsened is unc...",0.08095238095238096
34,"As far as the future is concerned, as I told your colleague just earlier on, there was unanimous agr...",0.175
35,"I know everybody would like some forward guidance, but in the current situation, with the degree of ...",0.0
36,"Now, your second question related to government spending, public investment: we take into account th...",0.05178571428571428
37,"The first question, unfortunately also on rates: The discussion today, was there any discussion abou...",0.08333333333333333
38,I don't have to wait for your second question. The answer is no....,0.0
39,Okay. The second question is on the revamp of the Executive Board over the next two years.That also ...,0.24500000000000002
40,"Well, let me clarify one thing. I don't have any favourite candidate, and I did not say that Klaas K...",0.4775
41,"I find it terribly satisfactory, in a way, that so many people want to have my job. It's a great job...",0.14375
42,But thank you. You have still a long time to ask all those questions....,-0.05
43,The euro's nominal effective exchange rate is at record levels. I know it's not a part of your manda...,0.6
44,"And second question, still regarding to currency: How do you balance the benefits of a strong euro f...",0.4066666666666666
45,"I might give you the answer that you expect, which is that we do not target exchange rate. We do ref...",0.125
46,And obviously it is something that we look at carefully as we look at the way in which currencies ar...,-0.025
47,"I have one question on inflation: The higher inflation in 2026 was justified, or explained, with hig...",-0.08958333333333332
48,And my second question again is on ECB succession. One of the sitting members of the Executive Board...,0.205
49,"On your first question, thank you for focusing on inflation on services because it's clearly one dom...",0.2866071428571429
50,"It's balanced out by goods, as you will have seen in the monetary policy statement. They go in oppos...",-0.045767195767195755
51,"But we are attentive because while we believe that a lot of the catch-up, for instance, has taken pl...",0.1142857142857143
52,"This is one that we really debated quite a bit and that we looked into, and staff is working really ...",-0.04305555555555555
53,"So, your question is: Can a sitting member of the Executive Board be eligible for another board posi...",0.0
54,"This matter was looked at in the past. It was looked at when Christian Noyer, the then Vice-Presiden...",-0.0625
55,"I think in both those instances, the determination by the jurists, the lawyers of various corners of...",0.0
56,"President Lagarde, I have two questions on financial stability, as it was also mentioned in the stat...",0.13333333333333333
57,"And also on financial stability and the digital euro project, which is making progress. The Council ...",0.125
58,I'll start with your second question. I know these are important moments for the digital euro becaus...,0.06666666666666667
59,"Our ambition is not to be role models. Our ambition is to make sure that in the digital age, there i...",0.12475490196078433
60,"On the other topic that you raised, I'm not going to expand on this matter, because it's something t...",0.002564102564102566
61,I have a follow-up question on your first comment about the changing growth profile due to AI. Isabe...,0.05625
62,"And my second question is on stablecoins. They have gained significant importance globally, but many...",0.21875
63,We are lucky in Europe to have something that is called MiCAR. It's the legal framework within which...,0.3444444444444444
64,"To the extent that it conforms to MiCAR, that it is properly organised, that it has the right one-to...",0.09523809523809523
65,"Where I have a concern is when you have (something that is getting a bit technical now, if we go the...",0.08833333333333333
66,"On your first question: Look, I'm not going to agonise over the issue of where and how is the r-star...",0.13088235294117645
67,"So, as I said, it's not observable, so to speak, and I think it's a very good debate to have, but I'...",0.18428571428571427
68,"I have two questions on the same issue, if I may. It's related to Ukraine. You know that in these ho...",0.15238095238095237
69,"And the second one is: Earlier this month, the ECB said we cannot provide a backstop to use the froz...",0.06466942148760331
70,"As you said before, for the case of Ms Schnabel, would it be possible to maybe look at it again, if ...",0.10357142857142856
71,"The first question: There is work going on at the moment. Again, it's not our remit, it's for the le...",0.18214285714285713
72,"We are an area of the world which prides itself for respecting the rule of law, and this is one of t...",0.15
